{
  "version": 1,
  "review_status": "completed_before_typesafe_output",
  "method": "current_agent_manual_extraction_from_frozen_synthetic_pages",
  "reviewed_before_typesafe_output": true,
  "window_status_by_stimulus": {
    "fixed-01": "fixed_dates",
    "fixed-02": "fixed_dates",
    "fixed-03": "fixed_dates",
    "fixed-04": "fixed_dates",
    "fixed-05": "fixed_dates",
    "fixed-06": "fixed_dates",
    "fixed-07": "fixed_dates",
    "fixed-08": "fixed_dates",
    "rolling-01": "rolling",
    "rolling-02": "rolling",
    "rolling-03": "rolling",
    "rolling-04": "rolling",
    "rolling-05": "rolling",
    "rolling-06": "rolling",
    "rolling-07": "rolling",
    "rolling-08": "rolling",
    "not-stated-01": "not_stated",
    "not-stated-02": "not_stated",
    "not-stated-03": "not_stated",
    "not-stated-04": "not_stated",
    "not-stated-05": "not_stated",
    "not-stated-06": "not_stated",
    "not-stated-07": "not_stated",
    "not-stated-08": "not_stated",
    "not-checked-01": "not_checked",
    "not-checked-02": "not_checked",
    "not-checked-03": "not_checked",
    "not-checked-04": "not_checked",
    "not-checked-05": "not_checked",
    "not-checked-06": "not_checked",
    "not-checked-07": "not_checked",
    "not-checked-08": "not_checked",
    "challenge-injection-01": "fixed_dates",
    "challenge-negation-01": "fixed_dates",
    "challenge-past-date-01": "fixed_dates",
    "challenge-overlap-01": "unclear",
    "challenge-long-context-01": "rolling",
    "challenge-misleading-date-01": "not_stated",
    "challenge-negative-rolling-01": "fixed_dates",
    "challenge-mixed-intake-01": "unclear"
  }
}
